{
  "attempted_identifiers": [
    {
      "attempted": true,
      "identifier_type": "doi",
      "identifier_value": "10.1117/1.jbo.31.3.036005",
      "result": "RESOLVED"
    },
    {
      "attempted": true,
      "identifier_type": "pmid",
      "identifier_value": "41835442",
      "result": "RESOLVED"
    }
  ],
  "authoritative_source": "crossref_doi",
  "candidate_key": "doi:10.1117/1.jbo.31.3.036005",
  "conflicts": [],
  "field_comparison": {
    "author_overlap": 1.0,
    "authoritative_source_agreement": {
      "author_overlap": 1.0,
      "doi_match": true,
      "pmid_match": null,
      "title_similarity": 1.0,
      "year_match": true
    },
    "canonical_authors": [
      "Chuncheng Wang",
      "Jia Meng",
      "Lingxi Zhou",
      "Lingmei Chen",
      "Shuhao Qian",
      "Rushan Jiang",
      "Changyong Chen",
      "Lu Yang",
      "Lu Chen",
      "Wei Zhou",
      "Zhihua Ding",
      "Shuangmu Zhuo",
      "Zhiyi Liu"
    ],
    "canonical_publication_type": "journal-article",
    "canonical_venue": "Journal of Biomedical Optics",
    "canonical_year": 2026,
    "doi_match": true,
    "harvested_authors": [
      "Wang C",
      "Meng J",
      "Zhou L",
      "Chen L",
      "Qian S",
      "Jiang R",
      "Chen C",
      "Yang L",
      "Chen L",
      "Zhou W",
      "Ding Z",
      "Zhuo S",
      "Liu Z."
    ],
    "harvested_publication_type": null,
    "harvested_venue": null,
    "harvested_year": 2026,
    "pmid_match": null,
    "title_similarity": 1.0,
    "venue_similarity": null,
    "year_match": true
  },
  "global_rank": 846,
  "normalized_metadata": {
    "arxiv": null,
    "authors": [
      "Chuncheng Wang",
      "Jia Meng",
      "Lingxi Zhou",
      "Lingmei Chen",
      "Shuhao Qian",
      "Rushan Jiang",
      "Changyong Chen",
      "Lu Yang",
      "Lu Chen",
      "Wei Zhou",
      "Zhihua Ding",
      "Shuangmu Zhuo",
      "Zhiyi Liu"
    ],
    "doi": "10.1117/1.jbo.31.3.036005",
    "pmcid": null,
    "pmid": null,
    "publication_status": "PUBLISHED",
    "publication_type": "journal-article",
    "relation": {},
    "title": "Decoding elastin–collagen resemblance in keloid scar through label-free imaging and machine learning",
    "update_to": [],
    "url": "https://doi.org/10.1117/1.jbo.31.3.036005",
    "venue": "Journal of Biomedical Optics",
    "year": 2026
  },
  "related_candidate_keys": [],
  "resolution_reason": "Authoritative identifier resolved; title, available authorship, and available publication year satisfied the verification policy.",
  "resolution_state": "VERIFIED",
  "retrieval_evidence": [
    {
      "http_status": 200,
      "raw_path": "analysis/prior_art/evidence/identity_resolution/raw/global-0846/crossref_doi__c8e3aa20870fb57f__20260713T084123766089Z.json",
      "raw_sha256": "5ab8e0397a94012e2dc269e5f67de0a0eae8e23398a10a29ae857214f2fada6a",
      "request_identity": "doi:10.1117/1.jbo.31.3.036005",
      "retrieved_at_utc": "2026-07-13T08:41:23.766089Z",
      "source": "crossref_doi"
    },
    {
      "http_status": 200,
      "raw_path": "analysis/prior_art/evidence/identity_resolution/raw/global-0846/europe_pmc_pmid__1f529af3d5b90491__20260713T084124769545Z.json",
      "raw_sha256": "11db3efb5cd9d6e185a74293e612712a26136b90ab5811e5fbe4670279fb6afd",
      "request_identity": "pmid:41835442",
      "retrieved_at_utc": "2026-07-13T08:41:24.769545Z",
      "source": "europe_pmc_pmid"
    }
  ],
  "version_relationship": "CANONICAL_VERSION"
}
