{
  "attempted_identifiers": [
    {
      "attempted": true,
      "identifier_type": "doi",
      "identifier_value": "10.1109/cvcs.2018.8496644",
      "result": "RESOLVED"
    }
  ],
  "authoritative_source": "crossref_doi",
  "candidate_key": "doi:10.1109/cvcs.2018.8496644",
  "conflicts": [],
  "field_comparison": {
    "author_overlap": 1.0,
    "canonical_authors": [
      "Enrique Gurdiel",
      "Jon Yngve Hardeberg"
    ],
    "canonical_publication_type": "proceedings-article",
    "canonical_venue": "2018 Colour and Visual Computing Symposium (CVCS)",
    "canonical_year": 2018,
    "doi_match": true,
    "harvested_authors": [
      "Enrique Gurdiel",
      "Jon Yngve Hardeberg"
    ],
    "harvested_publication_type": "proceedings-article",
    "harvested_venue": "2018 Colour and Visual Computing Symposium (CVCS)",
    "harvested_year": 2018,
    "pmid_match": null,
    "title_similarity": 1.0,
    "venue_similarity": 1.0,
    "year_match": true
  },
  "global_rank": 687,
  "normalized_metadata": {
    "arxiv": null,
    "authors": [
      "Enrique Gurdiel",
      "Jon Yngve Hardeberg"
    ],
    "doi": "10.1109/cvcs.2018.8496644",
    "pmcid": null,
    "pmid": null,
    "publication_status": "PUBLISHED",
    "publication_type": "proceedings-article",
    "relation": {},
    "title": "Spatially dependent white balance for fill flash photography",
    "update_to": [],
    "url": "https://doi.org/10.1109/cvcs.2018.8496644",
    "venue": "2018 Colour and Visual Computing Symposium (CVCS)",
    "year": 2018
  },
  "related_candidate_keys": [],
  "resolution_reason": "Authoritative identifier resolved; title, available authorship, and available publication year satisfied the verification policy.",
  "resolution_state": "VERIFIED",
  "retrieval_evidence": [
    {
      "http_status": 200,
      "raw_path": "analysis/prior_art/evidence/identity_resolution/raw/global-0687/crossref_doi__d22f2444c680dc79__20260713T083648303852Z.json",
      "raw_sha256": "2175f5122115e468cd492f26f5ff6f3b29c0835932c0c790ea7ab15a7a7d9785",
      "request_identity": "doi:10.1109/cvcs.2018.8496644",
      "retrieved_at_utc": "2026-07-13T08:36:48.303852Z",
      "source": "crossref_doi"
    }
  ],
  "version_relationship": "CANONICAL_VERSION"
}
