{
  "attempted_identifiers": [
    {
      "attempted": true,
      "identifier_type": "doi",
      "identifier_value": "10.1016/j.pacs.2023.100530",
      "result": "RESOLVED"
    },
    {
      "attempted": true,
      "identifier_type": "pmid",
      "identifier_value": "37645257",
      "result": "RESOLVED"
    }
  ],
  "authoritative_source": "crossref_doi",
  "candidate_key": "doi:10.1016/j.pacs.2023.100530",
  "conflicts": [],
  "field_comparison": {
    "author_overlap": 1.0,
    "authoritative_source_agreement": {
      "author_overlap": 1.0,
      "doi_match": true,
      "pmid_match": null,
      "title_similarity": 1.0,
      "year_match": true
    },
    "canonical_authors": [
      "Yang Xie",
      "Huayi Wu",
      "Ziyan Chen",
      "Qi Sun",
      "Xiangdong Liu",
      "Jinsheng Jiang",
      "Bo Wang",
      "Zeyu Chen"
    ],
    "canonical_publication_type": "journal-article",
    "canonical_venue": "Photoacoustics",
    "canonical_year": 2023,
    "doi_match": true,
    "harvested_authors": [
      "Xie Y",
      "Wu H",
      "Chen Z",
      "Sun Q",
      "Liu X",
      "Jiang J",
      "Wang B",
      "Chen Z."
    ],
    "harvested_publication_type": null,
    "harvested_venue": null,
    "harvested_year": 2023,
    "pmid_match": null,
    "title_similarity": 1.0,
    "venue_similarity": null,
    "year_match": true
  },
  "global_rank": 640,
  "normalized_metadata": {
    "arxiv": null,
    "authors": [
      "Yang Xie",
      "Huayi Wu",
      "Ziyan Chen",
      "Qi Sun",
      "Xiangdong Liu",
      "Jinsheng Jiang",
      "Bo Wang",
      "Zeyu Chen"
    ],
    "doi": "10.1016/j.pacs.2023.100530",
    "pmcid": null,
    "pmid": null,
    "publication_status": "PUBLISHED",
    "publication_type": "journal-article",
    "relation": {},
    "title": "Non-invasive evaluation of transdermal drug delivery using 3-D transient triplet differential (TTD) photoacoustic imaging",
    "update_to": [],
    "url": "https://doi.org/10.1016/j.pacs.2023.100530",
    "venue": "Photoacoustics",
    "year": 2023
  },
  "related_candidate_keys": [],
  "resolution_reason": "Authoritative identifier resolved; title, available authorship, and available publication year satisfied the verification policy.",
  "resolution_state": "VERIFIED",
  "retrieval_evidence": [
    {
      "http_status": 200,
      "raw_path": "analysis/prior_art/evidence/identity_resolution/raw/global-0640/crossref_doi__221ecc53b7d3b9dc__20260713T083549892251Z.json",
      "raw_sha256": "05b27fa6325143747efdad31346865a3c1e85d78ec6766e70071221984dcc645",
      "request_identity": "doi:10.1016/j.pacs.2023.100530",
      "retrieved_at_utc": "2026-07-13T08:35:49.892251Z",
      "source": "crossref_doi"
    },
    {
      "http_status": 200,
      "raw_path": "analysis/prior_art/evidence/identity_resolution/raw/global-0640/europe_pmc_pmid__de40eb73d77df1e2__20260713T083550874500Z.json",
      "raw_sha256": "db1884342b93774239ddad177673e83041f4c038a57c8f3da296904cf4140d2d",
      "request_identity": "pmid:37645257",
      "retrieved_at_utc": "2026-07-13T08:35:50.874500Z",
      "source": "europe_pmc_pmid"
    }
  ],
  "version_relationship": "CANONICAL_VERSION"
}
