{
  "attempted_identifiers": [
    {
      "attempted": true,
      "identifier_type": "doi",
      "identifier_value": "10.1109/tip.2024.3393390/mm4",
      "result": "RESOLVED"
    }
  ],
  "authoritative_source": "crossref_doi",
  "candidate_key": "doi:10.1109/tip.2024.3393390/mm4",
  "conflicts": [],
  "field_comparison": {
    "author_overlap": 1.0,
    "canonical_authors": [
      "Dong Huo"
    ],
    "canonical_publication_type": "component",
    "canonical_venue": null,
    "canonical_year": 2024,
    "doi_match": true,
    "harvested_authors": [
      "Dong Huo"
    ],
    "harvested_publication_type": "component",
    "harvested_venue": null,
    "harvested_year": null,
    "pmid_match": null,
    "title_similarity": 1.0,
    "venue_similarity": null,
    "year_match": null
  },
  "global_rank": 1136,
  "normalized_metadata": {
    "arxiv": null,
    "authors": [
      "Dong Huo"
    ],
    "doi": "10.1109/tip.2024.3393390/mm4",
    "pmcid": null,
    "pmid": null,
    "publication_status": "PUBLISHED",
    "publication_type": "component",
    "relation": {
      "is-component-of": [
        {
          "asserted-by": "object",
          "id": "10.1109/TIP.2024.3393390",
          "id-type": "doi"
        }
      ]
    },
    "title": "Learning to Recover Spectral Reflectance from RGB Images_supp5-3393390.pdf",
    "update_to": [],
    "url": "https://doi.org/10.1109/tip.2024.3393390/mm4",
    "venue": null,
    "year": 2024
  },
  "related_candidate_keys": [],
  "resolution_reason": "Authoritative identifier resolved; title, available authorship, and available publication year satisfied the verification policy.",
  "resolution_state": "VERIFIED",
  "retrieval_evidence": [
    {
      "http_status": 200,
      "raw_path": "analysis/prior_art/evidence/identity_resolution/raw/global-1136/crossref_doi__8a3d2952f78b0a5a__20260713T084807794348Z.json",
      "raw_sha256": "81de891ad5ee0ce1b7ab926ccbbb3a9797dabe12ef80b838e093b2bdc573ec97",
      "request_identity": "doi:10.1109/tip.2024.3393390/mm4",
      "retrieved_at_utc": "2026-07-13T08:48:07.794348Z",
      "source": "crossref_doi"
    }
  ],
  "version_relationship": "CANONICAL_VERSION"
}
