{
  "attempted_identifiers": [
    {
      "attempted": true,
      "identifier_type": "doi",
      "identifier_value": "10.1109/ietacs68750.2025.11385763",
      "result": "RESOLVED"
    }
  ],
  "authoritative_source": "crossref_doi",
  "candidate_key": "doi:10.1109/ietacs68750.2025.11385763",
  "conflicts": [],
  "field_comparison": {
    "author_overlap": 1.0,
    "canonical_authors": [
      "Shivam Chaurasiya",
      "Rohit Bajaj"
    ],
    "canonical_publication_type": "proceedings-article",
    "canonical_venue": "2025 International Conference on Innovations and Emerging Technologies In AI &amp; Communication Systems (IETACS)",
    "canonical_year": 2025,
    "doi_match": true,
    "harvested_authors": [
      "Shivam Chaurasiya",
      "Rohit Bajaj"
    ],
    "harvested_publication_type": "proceedings-article",
    "harvested_venue": "2025 International Conference on Innovations and Emerging Technologies In AI &amp;amp; Communication Systems (IETACS)",
    "harvested_year": 2025,
    "pmid_match": null,
    "title_similarity": 1.0,
    "venue_similarity": 0.928571,
    "year_match": true
  },
  "global_rank": 192,
  "normalized_metadata": {
    "arxiv": null,
    "authors": [
      "Shivam Chaurasiya",
      "Rohit Bajaj"
    ],
    "doi": "10.1109/ietacs68750.2025.11385763",
    "pmcid": null,
    "pmid": null,
    "publication_status": "PUBLISHED",
    "publication_type": "proceedings-article",
    "relation": {},
    "title": "Multi-Skin Tone Aware Skin Disease Classification Using Dual-Stream CNN-Transformer Fusion with Explainable Attention",
    "update_to": [],
    "url": "https://doi.org/10.1109/ietacs68750.2025.11385763",
    "venue": "2025 International Conference on Innovations and Emerging Technologies In AI &amp; Communication Systems (IETACS)",
    "year": 2025
  },
  "related_candidate_keys": [],
  "resolution_reason": "Authoritative identifier resolved; title, available authorship, and available publication year satisfied the verification policy.",
  "resolution_state": "VERIFIED",
  "retrieval_evidence": [
    {
      "http_status": 200,
      "raw_path": "analysis/prior_art/evidence/identity_resolution/raw/global-0192/crossref_doi__b81e6331fad466a5__20260713T082620354574Z.json",
      "raw_sha256": "10317755ae1b77a5781305c58dc6aa3e71d463ce87234aa69157b94db62af655",
      "request_identity": "doi:10.1109/ietacs68750.2025.11385763",
      "retrieved_at_utc": "2026-07-13T08:26:20.354574Z",
      "source": "crossref_doi"
    }
  ],
  "version_relationship": "CANONICAL_VERSION"
}
