{
  "attempted_identifiers": [
    {
      "attempted": true,
      "identifier_type": "doi",
      "identifier_value": "10.1177/12034754241308237",
      "result": "RESOLVED"
    },
    {
      "attempted": true,
      "identifier_type": "pmid",
      "identifier_value": "40542698",
      "result": "RESOLVED"
    }
  ],
  "authoritative_source": "crossref_doi",
  "candidate_key": "doi:10.1177/12034754241308237",
  "conflicts": [],
  "field_comparison": {
    "author_overlap": 1.0,
    "authoritative_source_agreement": {
      "author_overlap": 1.0,
      "doi_match": true,
      "pmid_match": null,
      "title_similarity": 1.0,
      "year_match": true
    },
    "canonical_authors": [
      "Dylan Hollman",
      "Chelsea Doktorchik",
      "Ilya Mukovozov"
    ],
    "canonical_publication_type": "journal-article",
    "canonical_venue": "Journal of Cutaneous Medicine and Surgery",
    "canonical_year": 2025,
    "doi_match": true,
    "harvested_authors": [
      "Hollman D",
      "Doktorchik C",
      "Mukovozov I."
    ],
    "harvested_publication_type": null,
    "harvested_venue": null,
    "harvested_year": 2025,
    "pmid_match": null,
    "title_similarity": 1.0,
    "venue_similarity": null,
    "year_match": true
  },
  "global_rank": 318,
  "normalized_metadata": {
    "arxiv": null,
    "authors": [
      "Dylan Hollman",
      "Chelsea Doktorchik",
      "Ilya Mukovozov"
    ],
    "doi": "10.1177/12034754241308237",
    "pmcid": null,
    "pmid": null,
    "publication_status": "PUBLISHED",
    "publication_type": "journal-article",
    "relation": {},
    "title": "Emerging Uses of Artificial Intelligence in Chronic Dermatologic Disease: A Scoping Review",
    "update_to": [],
    "url": "https://doi.org/10.1177/12034754241308237",
    "venue": "Journal of Cutaneous Medicine and Surgery",
    "year": 2025
  },
  "related_candidate_keys": [],
  "resolution_reason": "Authoritative identifier resolved; title, available authorship, and available publication year satisfied the verification policy.",
  "resolution_state": "VERIFIED",
  "retrieval_evidence": [
    {
      "http_status": 200,
      "raw_path": "analysis/prior_art/evidence/identity_resolution/raw/global-0318/crossref_doi__b46b758a876e1db3__20260713T082841252518Z.json",
      "raw_sha256": "bc3648c8ca8173bcc3809054471c17f68c9464445780318dba14fe4729954a20",
      "request_identity": "doi:10.1177/12034754241308237",
      "retrieved_at_utc": "2026-07-13T08:28:41.252518Z",
      "source": "crossref_doi"
    },
    {
      "http_status": 200,
      "raw_path": "analysis/prior_art/evidence/identity_resolution/raw/global-0318/europe_pmc_pmid__a4a99ff973d8ec8a__20260713T082842223307Z.json",
      "raw_sha256": "303f87733c6b0b366c3d4ea1b89dcba9c3dbe8d8fa5a4da068a40df952ca7532",
      "request_identity": "pmid:40542698",
      "retrieved_at_utc": "2026-07-13T08:28:42.223307Z",
      "source": "europe_pmc_pmid"
    }
  ],
  "version_relationship": "CANONICAL_VERSION"
}
