{
  "attempted_identifiers": [
    {
      "attempted": true,
      "identifier_type": "doi",
      "identifier_value": "10.1117/1.jbo.28.11.115001",
      "result": "RESOLVED"
    },
    {
      "attempted": true,
      "identifier_type": "pmid",
      "identifier_value": "38078153",
      "result": "RESOLVED"
    }
  ],
  "authoritative_source": "crossref_doi",
  "candidate_key": "doi:10.1117/1.jbo.28.11.115001",
  "conflicts": [],
  "field_comparison": {
    "author_overlap": 1.0,
    "authoritative_source_agreement": {
      "author_overlap": 1.0,
      "doi_match": true,
      "pmid_match": null,
      "title_similarity": 1.0,
      "year_match": true
    },
    "canonical_authors": [
      "Hanna Jonasson",
      "Ingemar Fredriksson",
      "Sara Bergstrand",
      "Carl Johan Östgren",
      "Marcus Larsson",
      "Tomas Strömberg"
    ],
    "canonical_publication_type": "journal-article",
    "canonical_venue": "Journal of Biomedical Optics",
    "canonical_year": 2023,
    "doi_match": true,
    "harvested_authors": [
      "Jonasson H",
      "Fredriksson I",
      "Bergstrand S",
      "Östgren CJ",
      "Larsson M",
      "Strömberg T."
    ],
    "harvested_publication_type": null,
    "harvested_venue": null,
    "harvested_year": 2023,
    "pmid_match": null,
    "title_similarity": 1.0,
    "venue_similarity": null,
    "year_match": true
  },
  "global_rank": 652,
  "normalized_metadata": {
    "arxiv": null,
    "authors": [
      "Hanna Jonasson",
      "Ingemar Fredriksson",
      "Sara Bergstrand",
      "Carl Johan Östgren",
      "Marcus Larsson",
      "Tomas Strömberg"
    ],
    "doi": "10.1117/1.jbo.28.11.115001",
    "pmcid": null,
    "pmid": null,
    "publication_status": "PUBLISHED",
    "publication_type": "journal-article",
    "relation": {},
    "title": "Absorption and reduced scattering coefficients in epidermis and dermis from a Swedish cohort study",
    "update_to": [],
    "url": "https://doi.org/10.1117/1.jbo.28.11.115001",
    "venue": "Journal of Biomedical Optics",
    "year": 2023
  },
  "related_candidate_keys": [],
  "resolution_reason": "Authoritative identifier resolved; title, available authorship, and available publication year satisfied the verification policy.",
  "resolution_state": "VERIFIED",
  "retrieval_evidence": [
    {
      "http_status": 200,
      "raw_path": "analysis/prior_art/evidence/identity_resolution/raw/global-0652/crossref_doi__6293acc80ab9766d__20260713T083612513994Z.json",
      "raw_sha256": "4ae0103a184d5435b6dd4520a9562a998e7096895f74cfef170061407ec22605",
      "request_identity": "doi:10.1117/1.jbo.28.11.115001",
      "retrieved_at_utc": "2026-07-13T08:36:12.513994Z",
      "source": "crossref_doi"
    },
    {
      "http_status": 200,
      "raw_path": "analysis/prior_art/evidence/identity_resolution/raw/global-0652/europe_pmc_pmid__b4bd5328c8234ffa__20260713T083613656122Z.json",
      "raw_sha256": "c223ff094304e394aa695b070d426ea262bbf22a8e7883262ffe1f5c392523ae",
      "request_identity": "pmid:38078153",
      "retrieved_at_utc": "2026-07-13T08:36:13.656122Z",
      "source": "europe_pmc_pmid"
    }
  ],
  "version_relationship": "CANONICAL_VERSION"
}
