{
  "attempted_identifiers": [
    {
      "attempted": true,
      "identifier_type": "doi",
      "identifier_value": "10.1038/s43856-024-00550-7",
      "result": "RESOLVED"
    },
    {
      "attempted": true,
      "identifier_type": "pmid",
      "identifier_value": "38992188",
      "result": "RESOLVED"
    }
  ],
  "authoritative_source": "crossref_doi",
  "candidate_key": "doi:10.1038/s43856-024-00550-7",
  "conflicts": [],
  "field_comparison": {
    "author_overlap": 1.0,
    "authoritative_source_agreement": {
      "author_overlap": 1.0,
      "doi_match": true,
      "pmid_match": null,
      "title_similarity": 1.0,
      "year_match": true
    },
    "canonical_authors": [
      "Sandhya Vasudevan",
      "William C. Vogt",
      "Sandy Weininger",
      "T. Joshua Pfefer"
    ],
    "canonical_publication_type": "journal-article",
    "canonical_venue": "Communications Medicine",
    "canonical_year": 2024,
    "doi_match": true,
    "harvested_authors": [
      "Vasudevan S",
      "Vogt WC",
      "Weininger S",
      "Pfefer TJ."
    ],
    "harvested_publication_type": null,
    "harvested_venue": null,
    "harvested_year": 2024,
    "pmid_match": null,
    "title_similarity": 1.0,
    "venue_similarity": null,
    "year_match": true
  },
  "global_rank": 170,
  "normalized_metadata": {
    "arxiv": null,
    "authors": [
      "Sandhya Vasudevan",
      "William C. Vogt",
      "Sandy Weininger",
      "T. Joshua Pfefer"
    ],
    "doi": "10.1038/s43856-024-00550-7",
    "pmcid": null,
    "pmid": null,
    "publication_status": "PUBLISHED",
    "publication_type": "journal-article",
    "relation": {},
    "title": "Melanometry for objective evaluation of skin pigmentation in pulse oximetry studies",
    "update_to": [],
    "url": "https://doi.org/10.1038/s43856-024-00550-7",
    "venue": "Communications Medicine",
    "year": 2024
  },
  "related_candidate_keys": [],
  "resolution_reason": "Authoritative identifier resolved; title, available authorship, and available publication year satisfied the verification policy.",
  "resolution_state": "VERIFIED",
  "retrieval_evidence": [
    {
      "http_status": 200,
      "raw_path": "analysis/prior_art/evidence/identity_resolution/raw/global-0170/crossref_doi__dbf731becdd484eb__20260713T082603322618Z.json",
      "raw_sha256": "c0d8a9489ce94ca0e3c9697a6b6893668365bcdba9a14633183cc7fa6ad18205",
      "request_identity": "doi:10.1038/s43856-024-00550-7",
      "retrieved_at_utc": "2026-07-13T08:26:03.322618Z",
      "source": "crossref_doi"
    },
    {
      "http_status": 200,
      "raw_path": "analysis/prior_art/evidence/identity_resolution/raw/global-0170/europe_pmc_pmid__2dcfbf35f6af9b89__20260713T082604430428Z.json",
      "raw_sha256": "c25d4cfc8a946cd855641c20dea9a51ef29de8dac84bb99a39320b4712342988",
      "request_identity": "pmid:38992188",
      "retrieved_at_utc": "2026-07-13T08:26:04.430428Z",
      "source": "europe_pmc_pmid"
    }
  ],
  "version_relationship": "CANONICAL_VERSION"
}
