{
  "attempted_identifiers": [
    {
      "attempted": true,
      "identifier_type": "doi",
      "identifier_value": "10.5040/9781501374616.ch-13",
      "result": "RESOLVED"
    }
  ],
  "authoritative_source": "crossref_doi",
  "candidate_key": "doi:10.5040/9781501374616.ch-13",
  "conflicts": [],
  "field_comparison": {
    "author_overlap": null,
    "canonical_authors": [],
    "canonical_publication_type": "other",
    "canonical_venue": "Multi-Camera Cinematography and Production",
    "canonical_year": 2024,
    "doi_match": true,
    "harvested_authors": [],
    "harvested_publication_type": "other",
    "harvested_venue": "Multi-Camera Cinematography and Production",
    "harvested_year": 2024,
    "pmid_match": null,
    "title_similarity": 1.0,
    "venue_similarity": 1.0,
    "year_match": true
  },
  "global_rank": 542,
  "normalized_metadata": {
    "arxiv": null,
    "authors": [],
    "doi": "10.5040/9781501374616.ch-13",
    "pmcid": null,
    "pmid": null,
    "publication_status": "PUBLISHED",
    "publication_type": "other",
    "relation": {},
    "title": "Lighting Scripted Studio Productions",
    "update_to": [],
    "url": "https://doi.org/10.5040/9781501374616.ch-13",
    "venue": "Multi-Camera Cinematography and Production",
    "year": 2024
  },
  "related_candidate_keys": [],
  "resolution_reason": "Authoritative identifier resolved; title, available authorship, and available publication year satisfied the verification policy.",
  "resolution_state": "VERIFIED",
  "retrieval_evidence": [
    {
      "http_status": 200,
      "raw_path": "analysis/prior_art/evidence/identity_resolution/raw/global-0542/crossref_doi__fde1074c55922294__20260713T083344209222Z.json",
      "raw_sha256": "aeb219c7d8e767f60fd00f5042da2464a23c47e2af53405eb73f87654e054910",
      "request_identity": "doi:10.5040/9781501374616.ch-13",
      "retrieved_at_utc": "2026-07-13T08:33:44.209222Z",
      "source": "crossref_doi"
    }
  ],
  "version_relationship": "CANONICAL_VERSION"
}
