{
  "attempted_identifiers": [
    {
      "attempted": true,
      "identifier_type": "doi",
      "identifier_value": "10.2196/preprints.31697",
      "result": "RESOLVED"
    }
  ],
  "authoritative_source": "crossref_doi",
  "candidate_key": "doi:10.2196/preprints.31697",
  "conflicts": [],
  "field_comparison": {
    "author_overlap": 1.0,
    "canonical_authors": [
      "Pushkar Aggarwal"
    ],
    "canonical_publication_type": "posted-content",
    "canonical_venue": null,
    "canonical_year": 2021,
    "doi_match": true,
    "harvested_authors": [
      "Pushkar Aggarwal"
    ],
    "harvested_publication_type": "posted-content",
    "harvested_venue": null,
    "harvested_year": 2021,
    "pmid_match": null,
    "title_similarity": 1.0,
    "venue_similarity": null,
    "year_match": true
  },
  "global_rank": 290,
  "normalized_metadata": {
    "arxiv": null,
    "authors": [
      "Pushkar Aggarwal"
    ],
    "doi": "10.2196/preprints.31697",
    "pmcid": null,
    "pmid": null,
    "publication_status": "PUBLISHED",
    "publication_type": "posted-content",
    "relation": {
      "is-preprint-of": [
        {
          "asserted-by": "subject",
          "id": "10.2196/31697",
          "id-type": "doi"
        }
      ]
    },
    "title": "Performance of Artificial Intelligence Imaging Models in Detecting Dermatological Manifestations in Higher Fitzpatrick Skin Color Classifications (Preprint)",
    "update_to": [],
    "url": "https://doi.org/10.2196/preprints.31697",
    "venue": null,
    "year": 2021
  },
  "related_candidate_keys": [],
  "resolution_reason": "Authoritative identifier resolved; title, available authorship, and available publication year satisfied the verification policy.",
  "resolution_state": "VERIFIED",
  "retrieval_evidence": [
    {
      "http_status": 200,
      "raw_path": "analysis/prior_art/evidence/identity_resolution/raw/global-0290/crossref_doi__b0ebc90b8d092bb7__20260713T082804673016Z.json",
      "raw_sha256": "acbdcd75405ba7cef3831bf02b6a7c62a0d554d1222ac2902f021b54c2f7d0f2",
      "request_identity": "doi:10.2196/preprints.31697",
      "retrieved_at_utc": "2026-07-13T08:28:04.673016Z",
      "source": "crossref_doi"
    }
  ],
  "version_relationship": "CANONICAL_VERSION"
}
