{
  "attempted_identifiers": [
    {
      "attempted": true,
      "identifier_type": "doi",
      "identifier_value": "10.1002/0470090154.ch3",
      "result": "RESOLVED"
    }
  ],
  "authoritative_source": "crossref_doi",
  "candidate_key": "doi:10.1002/0470090154.ch3",
  "conflicts": [],
  "field_comparison": {
    "author_overlap": null,
    "canonical_authors": [],
    "canonical_publication_type": "other",
    "canonical_venue": "Classification, Parameter Estimation and State Estimation",
    "canonical_year": 2004,
    "doi_match": true,
    "harvested_authors": [],
    "harvested_publication_type": "other",
    "harvested_venue": "Classification, Parameter Estimation and State Estimation",
    "harvested_year": 2004,
    "pmid_match": null,
    "title_similarity": 1.0,
    "venue_similarity": 1.0,
    "year_match": true
  },
  "global_rank": 1115,
  "normalized_metadata": {
    "arxiv": null,
    "authors": [],
    "doi": "10.1002/0470090154.ch3",
    "pmcid": null,
    "pmid": null,
    "publication_status": "PUBLISHED",
    "publication_type": "other",
    "relation": {},
    "title": "Parameter Estimation",
    "update_to": [],
    "url": "https://doi.org/10.1002/0470090154.ch3",
    "venue": "Classification, Parameter Estimation and State Estimation",
    "year": 2004
  },
  "related_candidate_keys": [],
  "resolution_reason": "Authoritative identifier resolved; title, available authorship, and available publication year satisfied the verification policy.",
  "resolution_state": "VERIFIED",
  "retrieval_evidence": [
    {
      "http_status": 200,
      "raw_path": "analysis/prior_art/evidence/identity_resolution/raw/global-1115/crossref_doi__356d3e3202910c3d__20260713T084753197639Z.json",
      "raw_sha256": "38287371aada365e967e236287658dba92e0ff124fb8dee72a2b2a109ced07e3",
      "request_identity": "doi:10.1002/0470090154.ch3",
      "retrieved_at_utc": "2026-07-13T08:47:53.197639Z",
      "source": "crossref_doi"
    }
  ],
  "version_relationship": "CANONICAL_VERSION"
}
